{
  "name": "an unverified hirer can sign in but cannot hire",
  "description": "ADR-0002: registration and hiring capability are separate. An unverified hirer sees their own dashboard and nothing else — RequireHiringCapability gates search, scorecards, and shortlisting. Verification is manual and is the real gate; the identity provider is not.",
  "seed": ["principals", "catalogue"],
  "steps": [
    {
      "_step": "Signing in works. Being unverified is not being locked out.",
      "as": "pending_pat",
      "request": {
        "method": "GET",
        "path": "/me"
      },
      "expect": {
        "status": 200,
        "body": {
          "id": "<uuid>",
          "kind": "hirer",
          "display_name": "Pat Ferreira",
          "verified": false,
          "organization": {
            "name": "Unknown Ltd",
            "verified": false
          },
          "capabilities": {
            "can_search": false,
            "can_shortlist": false,
            "can_view_scorecards": false
          }
        }
      }
    },
    {
      "as": "pending_pat",
      "request": {
        "method": "GET",
        "path": "/search?skills=go"
      },
      "expect": {
        "status": 403,
        "body": {
          "error": "hiring_capability_required",
          "hirer_verified": false,
          "organization_verified": false
        }
      }
    },
    {
      "as": "pending_pat",
      "request": {
        "method": "GET",
        "path": "/contributors/{{alice.id}}/scorecard"
      },
      "expect": {
        "status": 403,
        "body": {
          "error": "hiring_capability_required",
          "hirer_verified": false,
          "organization_verified": false
        }
      }
    },
    {
      "_step": "A verified hirer in a verified org passes the same gate.",
      "as": "hank",
      "request": {
        "method": "GET",
        "path": "/search?skills=go"
      },
      "expect": {
        "status": 200,
        "body": {
          "total": 0,
          "inactive_hidden": 0,
          "ranked_by": "skill:go",
          "page": 1,
          "per_page": 20,
          "results": []
        }
      }
    },
    {
      "_step": "Verified hirer, UNVERIFIED organization — still refused. Both must be verified (ADR-0002), and the refusal lands on the act that would reach a person: putting somebody on a job.",
      "as": "pending_pat",
      "request": {
        "method": "POST",
        "path": "/org-roles/{{unverified_org.id}}/roles/{{unverified_org.role}}/candidates",
        "body": {
          "user_id": "01920000-0000-7000-8000-00000000a001"
        }
      },
      "expect": {
        "status": 403,
        "body": {
          "error": "hiring_capability_required",
          "hirer_verified": false,
          "organization_verified": false
        }
      }
    }
  ]
}
